<?xml version="1.0" encoding="UTF-8"?>
<xs:schema xmlns:xs="http://www.w3.org/2001/XMLSchema">
  <xs:element name="Data">
    <xs:complexType>
      <xs:sequence>
        <xs:element name="Player" maxOccurs="unbounded">
          <xs:complexType>
            <xs:sequence>
              <xs:element name="Nickname" type="xs:string" />
              <xs:element name="Password" type="xs:string" />
              <xs:element name="Picture" type="xs:string"/>
			<!--  <xs:element name="WinsNumber" type="xs:int"/> -->
            </xs:sequence>
          </xs:complexType>
        </xs:element>
      </xs:sequence>
    </xs:complexType>
  </xs:element>
</xs:schema>